{
  "run_id": "dream_run_example_2026_05_18_001",
  "input": {
    "canonical_store_refs": [
      {
        "source_type": "memory",
        "source_id": "L1-C/anchor_set/2026-05-17"
      }
    ],
    "proposed_store_refs": [
      {
        "source_type": "memory",
        "source_id": "L1-P/proposed_set/2026-05-17"
      }
    ],
    "quarantined_store_refs": [
      {
        "source_type": "memory",
        "source_id": "L1-Q/quarantined_set/2026-05-17"
      }
    ],
    "deprecated_ledger_refs": [
      {
        "source_type": "memory",
        "source_id": "L1-D/superseded_set/2026-05-17"
      }
    ],
    "session_transcript_refs": [
      {
        "source_type": "session",
        "source_id": "session_2026_05_17_a",
        "span": "turns 14-22"
      },
      {
        "source_type": "session",
        "source_id": "session_2026_05_17_b"
      }
    ],
    "com_telemetry_refs": [
      {
        "source_type": "com_log",
        "source_id": "com_log_2026_05_17"
      }
    ],
    "policy": {
      "allow_direct_canonical_write": false,
      "require_provenance": true,
      "require_approval": true,
      "max_contradiction_risk": 0.4
    }
  },
  "output": {
    "candidate_store": [
      {
        "id": "node_reconcile_dedup_v1",
        "content": "User prefers terse responses without trailing summaries.",
        "claim_type": "preference",
        "status": "proposed",
        "confidence": "high",
        "provenance": [
          {
            "source_type": "session",
            "source_id": "session_2026_05_17_a",
            "span": "turn 18"
          },
          {
            "source_type": "session",
            "source_id": "session_2026_05_17_b",
            "span": "turn 4"
          }
        ],
        "evidence_count": 2,
        "review_required": false
      },
      {
        "id": "node_supersede_replacement_v1",
        "content": "Project ships behind feature flag dream_compiler_enabled, default off.",
        "claim_type": "project_state",
        "status": "proposed",
        "confidence": "medium",
        "provenance": [
          {
            "source_type": "session",
            "source_id": "session_2026_05_17_a",
            "span": "turn 20"
          }
        ],
        "evidence_count": 1,
        "supersedes": [
          "node_old_project_state_v0"
        ],
        "valid_from": "2026-05-17",
        "review_required": true
      },
      {
        "id": "node_retcon_replacement_v1",
        "content": "Looking-Glass extension is research-only, not a release-blocking gate.",
        "claim_type": "decision",
        "status": "proposed",
        "confidence": "medium",
        "provenance": [
          {
            "source_type": "com_log",
            "source_id": "com_log_2026_05_17",
            "span": "release_gate_section"
          }
        ],
        "evidence_count": 1,
        "supersedes": [
          "node_old_decision_v0"
        ],
        "review_required": true
      },
      {
        "id": "node_quarantined_contradiction_v1",
        "content": "Memory Dreaming runs autonomously without human approval.",
        "claim_type": "boundary",
        "status": "quarantined",
        "confidence": "low",
        "provenance": [
          {
            "source_type": "session",
            "source_id": "session_2026_05_17_a",
            "span": "turn 31"
          }
        ],
        "evidence_count": 1,
        "contradicts": [
          "node_boundary_canonical_v1"
        ],
        "review_required": true
      },
      {
        "id": "node_deprecated_stale_v1",
        "content": "Old benchmark scaffold ran on three legacy models.",
        "claim_type": "project_state",
        "status": "deprecated",
        "confidence": "high",
        "provenance": [
          {
            "source_type": "artifact",
            "source_id": "validation_artifacts/com_grammar/manifest_v0.json"
          }
        ],
        "evidence_count": 1,
        "valid_until": "2026-05-17",
        "review_required": false
      }
    ],
    "diff": [
      {
        "op": "keep",
        "target_id": "node_canonical_keep_v1",
        "reason": "Node still valid; evidence unchanged.",
        "provenance": [
          {
            "source_type": "memory",
            "source_id": "L1-C/anchor_set/2026-05-17"
          }
        ],
        "cap": {
          "evidence": "high",
          "claim_strength": "high",
          "contradiction_risk": 0.05,
          "transition_cost": 0,
          "validator": "pass"
        }
      },
      {
        "op": "reconcile",
        "target_id": "node_reconcile_dedup_v1",
        "reason": "Two compatible preference traces merged into one anchor.",
        "provenance": [
          {
            "source_type": "session",
            "source_id": "session_2026_05_17_a"
          },
          {
            "source_type": "session",
            "source_id": "session_2026_05_17_b"
          }
        ],
        "cap": {
          "evidence": "high",
          "claim_strength": "high",
          "contradiction_risk": 0.1,
          "transition_cost": 0.2,
          "validator": "pass"
        }
      },
      {
        "op": "deprecate",
        "target_id": "node_deprecated_stale_v1",
        "reason": "Legacy benchmark scaffold superseded by current manifest.",
        "provenance": [
          {
            "source_type": "artifact",
            "source_id": "validation_artifacts/com_grammar/manifest_v0.json"
          }
        ],
        "cap": {
          "evidence": "high",
          "claim_strength": "medium",
          "contradiction_risk": 0.05,
          "transition_cost": 0.1,
          "validator": "pass"
        }
      },
      {
        "op": "supersede",
        "target_id": "node_old_project_state_v0",
        "proposed_id": "node_supersede_replacement_v1",
        "reason": "Project state updated; old anchor preserved in L1-D for audit.",
        "provenance": [
          {
            "source_type": "session",
            "source_id": "session_2026_05_17_a",
            "span": "turn 20"
          }
        ],
        "cap": {
          "evidence": "medium",
          "claim_strength": "medium",
          "contradiction_risk": 0.15,
          "transition_cost": 0.3,
          "validator": "needs_review"
        }
      },
      {
        "op": "retcon",
        "target_id": "node_old_decision_v0",
        "proposed_id": "node_retcon_replacement_v1",
        "reason": "Earlier reading of Looking-Glass extension as release-blocking was wrong.",
        "provenance": [
          {
            "source_type": "com_log",
            "source_id": "com_log_2026_05_17"
          }
        ],
        "cap": {
          "evidence": "medium",
          "claim_strength": "medium",
          "contradiction_risk": 0.2,
          "transition_cost": 0.4,
          "validator": "needs_review"
        }
      },
      {
        "op": "quarantine",
        "target_id": "node_quarantined_contradiction_v1",
        "reason": "Claim contradicts canonical approval-gate boundary; needs human review.",
        "provenance": [
          {
            "source_type": "session",
            "source_id": "session_2026_05_17_a",
            "span": "turn 31"
          }
        ],
        "cap": {
          "evidence": "low",
          "claim_strength": "low",
          "contradiction_risk": 0.9,
          "transition_cost": 0,
          "validator": "block"
        }
      },
      {
        "op": "rollback",
        "reason": "One candidate merged unrelated project branches; rolling back that diff.",
        "provenance": [
          {
            "source_type": "memory",
            "source_id": "L1-P/proposed_set/2026-05-17"
          }
        ],
        "cap": {
          "evidence": "low",
          "claim_strength": "low",
          "contradiction_risk": 0.7,
          "transition_cost": 0,
          "validator": "block"
        }
      }
    ],
    "review_items": [
      {
        "id": "review_supersede_001",
        "diff_index": 3,
        "reason": "Supersede of project_state requires confirmation that old branch is closed.",
        "required_action": "human_review"
      },
      {
        "id": "review_retcon_001",
        "diff_index": 4,
        "reason": "Retcon changes interpretation of release-gate scope; needs approver sign-off.",
        "required_action": "approve"
      },
      {
        "id": "review_quarantine_001",
        "diff_index": 5,
        "reason": "Quarantine reason references contradicted canonical boundary; verify provenance.",
        "required_action": "inspect_provenance"
      }
    ],
    "rejected_items": [
      {
        "id": "node_rejected_weak_v1",
        "content": "User wants Dream output committed directly to canonical store.",
        "claim_type": "preference",
        "status": "rejected",
        "confidence": "low",
        "provenance": [
          {
            "source_type": "session",
            "source_id": "session_2026_05_17_a",
            "span": "turn 33"
          }
        ],
        "evidence_count": 1,
        "review_required": false
      }
    ],
    "telemetry": [
      "candidate_store_size=5",
      "diff_count=7",
      "quarantined=1",
      "rolled_back_diff_indexes=[6]"
    ]
  },
  "approval": {
    "status": "partially_approved",
    "approved_diff_indexes": [
      0,
      1,
      2
    ],
    "approver": "release_gate@cap.local",
    "approval_note": "keep / reconcile / deprecate approved; supersede + retcon + quarantine remain in review; rollback executed."
  },
  "notes": "Reference example covering all seven diff operations. Used by test_memory_dreaming_schema.py and check_repo.ps1 smoke."
}
